No.;Time;Source;Destination;Protocol;Length;Info;;;;;;;;;Time 1
71;0.113440;192.168.100.17;35.186.224.47;TLSv1.2;97;Application Data;;;;;;;;;0.113440
72;0.139595;35.186.224.47;192.168.100.17;TCP;54;443  >  65379 [ACK] Seq=1 Ack=44 Win=272 Len=0;;;;;;;;;0.139595
73;0.191037;35.186.224.47;192.168.100.17;TLSv1.2;94;Application Data;;;;;;;;;0.191037
74;0.233036;192.168.100.17;35.186.224.47;TCP;54;65379  >  443 [ACK] Seq=44 Ack=41 Win=255 Len=0;;;;;;;;;0.233036
75;1.504.507;192.168.100.17;35.186.224.25;TLSv1.2;136;Application Data;;;;;;;;;1504507
76;1.504.664;192.168.100.17;35.186.224.25;TLSv1.2;93;Application Data;;;;;;;;;1504664
77;1.504.716;192.168.100.17;35.186.224.25;TLSv1.2;581;Application Data;;;;;;;;;1504716
78;1.520.187;35.186.224.25;192.168.100.17;TCP;56;443  >  55359 [ACK] Seq=1 Ack=83 Win=1037 Len=0;;;;;;;;;1520187
79;1.521.212;35.186.224.25;192.168.100.17;TCP;56;443  >  55359 [ACK] Seq=1 Ack=122 Win=1037 Len=0;;;;;;;;;1521212
80;1.521.560;35.186.224.25;192.168.100.17;TCP;56;443  >  55359 [ACK] Seq=1 Ack=649 Win=1048 Len=0;;;;;;;;;1521560
81;1.522.981;35.186.224.25;192.168.100.17;TLSv1.2;93;Application Data;;;;;;;;;1522981
82;1.568.229;192.168.100.17;35.186.224.25;TCP;54;55359  >  443 [ACK] Seq=649 Ack=40 Win=512 Len=0;;;;;;;;;1568229
83;1.640.506;35.186.224.25;192.168.100.17;TLSv1.2;140;Application Data;;;;;;;;;1640506
84;1.642.437;192.168.100.17;35.186.224.25;TLSv1.2;93;Application Data;;;;;;;;;1642437
85;1.663.724;35.186.224.25;192.168.100.17;TCP;56;443  >  55359 [ACK] Seq=126 Ack=688 Win=1048 Len=0;;;;;;;;;1663724
86;2.306.039;131.253.33.203;192.168.100.17;TCP;54;443  >  63189 [RST, ACK] Seq=1 Ack=1 Win=0 Len=0;;;;;;;;;2306039
87;2.478.914;192.168.100.17;20.197.71.89;TLSv1.2;97;Application Data;;;;;;;;;2478914
88;2.510.467;20.197.71.89;192.168.100.17;TLSv1.2;228;Application Data;;;;;;;;;2510467
89;2.548.934;192.168.100.17;35.186.224.47;TLSv1.2;89;Application Data;;;;;;;;;2548934
90;2.559.218;192.168.100.17;20.197.71.89;TCP;54;63072  >  443 [ACK] Seq=44 Ack=175 Win=258 Len=0;;;;;;;;;2559218
91;2.563.406;35.186.224.47;192.168.100.17;TCP;56;443  >  65461 [ACK] Seq=1 Ack=36 Win=266 Len=0;;;;;;;;;2563406
92;2.622.291;35.186.224.47;192.168.100.17;TLSv1.2;85;Application Data;;;;;;;;;2622291
93;2.672.791;192.168.100.17;35.186.224.47;TCP;54;65461  >  443 [ACK] Seq=36 Ack=32 Win=509 Len=0;;;;;;;;;2672791
113;8.860.656;13.67.74.235;192.168.100.17;TLSv1.2;353;Application Data;;;;;;;;;8860656
114;8.863.004;192.168.100.17;13.67.74.235;TLSv1.2;96;Application Data;;;;;;;;;8863004
115;8.897.688;192.168.100.17;13.67.74.235;TLSv1.2;219;Application Data;;;;;;;;;8897688
116;8.925.430;13.67.74.235;192.168.100.17;TCP;54;443  >  63080 [ACK] Seq=300 Ack=208 Win=2050 Len=0;;;;;;;;;8925430
117;8.950.397;192.168.100.17;52.163.231.110;TLSv1.2;112;Application Data;;;;;;;;;8950397
118;8.977.832;52.163.231.110;192.168.100.17;TLSv1.2;101;Application Data;;;;;;;;;8977832
119;8.983.482;192.168.100.17;35.186.224.25;TCP;55;55370  >  443 [ACK] Seq=1 Ack=1 Win=508 Len=1 [TCP segment of a reassembled PDU];;;;;;;;;8983482
120;9.013.712;35.186.224.25;192.168.100.17;TCP;66;443  >  55370 [ACK] Seq=1 Ack=2 Win=597 Len=0 SLE=1 SRE=2;;;;;;;;;9013712
121;9.025.580;192.168.100.17;52.163.231.110;TCP;54;63081  >  443 [ACK] Seq=59 Ack=48 Win=256 Len=0;;;;;;;;;9025580
188;9.281.564;192.168.100.17;35.186.224.13;TCP;55;65460  >  443 [ACK] Seq=1 Ack=1 Win=509 Len=1 [TCP segment of a reassembled PDU];;;;;;;;;9281564
189;9.345.238;35.186.224.13;192.168.100.17;TCP;66;443  >  65460 [ACK] Seq=1 Ack=2 Win=736 Len=0 SLE=1 SRE=2;;;;;;;;;9345238
190;11.726.256;13.107.21.200;192.168.100.17;TCP;56;443  >  63193 [RST, ACK] Seq=1 Ack=1 Win=0 Len=0;;;;;;;;;11726256
191;12.342.734;157.240.208.60;192.168.100.17;TLSv1.2;93;Application Data;;;;;;;;;12342734
192;12.342.734;157.240.208.60;192.168.100.17;TCP;54;443  >  63198 [FIN, ACK] Seq=40 Ack=1 Win=65535 Len=0;;;;;;;;;12342734
193;12.342.871;192.168.100.17;157.240.208.60;TCP;54;63198  >  443 [ACK] Seq=1 Ack=41 Win=64913 Len=0;;;;;;;;;12342871
194;12.343.360;192.168.100.17;157.240.208.60;TCP;54;63198  >  443 [FIN, ACK] Seq=1 Ack=41 Win=64913 Len=0;;;;;;;;;12343360
195;12.356.826;157.240.208.60;192.168.100.17;TCP;56;443  >  63198 [ACK] Seq=41 Ack=2 Win=65535 Len=0;;;;;;;;;12356826
196;12.660.664;192.168.100.17;162.159.133.234;TLSv1.2;105;Application Data;;;;;;;;;12660664
197;12.677.476;162.159.133.234;192.168.100.17;TCP;56;443  >  63063 [ACK] Seq=1 Ack=52 Win=76 Len=0;;;;;;;;;12677476
198;12.955.965;162.159.133.234;192.168.100.17;TLSv1.2;86;Application Data;;;;;;;;;12955965
199;13.008.530;192.168.100.17;162.159.133.234;TCP;54;63063  >  443 [ACK] Seq=52 Ack=33 Win=510 Len=0;;;;;;;;;13008530
207;17.912.177;192.168.100.17;157.240.208.60;TLSv1.2;85;Application Data;;;;;;;;;17912177
208;17.928.122;157.240.208.60;192.168.100.17;TCP;56;443  >  63179 [ACK] Seq=1 Ack=32 Win=65535 Len=0;;;;;;;;;17928122
209;18.179.382;157.240.208.60;192.168.100.17;TLSv1.2;92;Application Data;;;;;;;;;18179382
210;0.113440;192.168.100.17;157.240.208.60;TCP;54;63179  >  443 [ACK] Seq=32 Ack=39 Win=64043 Len=0;;;;;;;;;0.113440
1278;0.139595;192.168.100.17;104.26.14.183;TCP;55;63100  >  443 [ACK] Seq=1 Ack=1 Win=64952 Len=1 [TCP segment of a reassembled PDU];;;;;;;;;0.139595
1454;0.191037;104.26.14.183;192.168.100.17;TCP;54;443  >  63100 [ACK] Seq=1 Ack=2 Win=65535 Len=0;;;;;;;;;0.191037
1744;0.233036;192.168.100.17;52.113.194.132;TCP;66;63201  >  443 [SYN] Seq=0 Win=64240 Len=0 MSS=1460 WS=256 SACK_PERM=1;;;;;;;;;0.233036
1745;16.216.533;52.113.194.132;192.168.100.17;TCP;66;443  >  63201 [SYN, ACK] Seq=0 Ack=1 Win=65535 Len=0 MSS=1412 WS=256 SACK_PERM=1;;;;;;;;;16216532,53
1746;16.620.372;192.168.100.17;52.113.194.132;TCP;54;63201  >  443 [ACK] Seq=1 Ack=1 Win=131072 Len=0;;;;;;;;;16620372,32
1747;17.024.212;192.168.100.17;52.113.194.132;TLSv1.2;626;Client Hello;;;;;;;;;17024212,1
1748;17.428.052;52.113.194.132;192.168.100.17;TCP;54;443  >  63201 [ACK] Seq=1 Ack=573 Win=524544 Len=0;;;;;;;;;17428051,88
1749;17.831.892;52.113.194.132;192.168.100.17;TLSv1.2;208;Server Hello, Change Cipher Spec, Encrypted Handshake Message;;;;;;;;;17831891,67
1750;18.235.731;192.168.100.17;52.113.194.132;TLSv1.2;105;Change Cipher Spec, Encrypted Handshake Message;;;;;;;;;18235731,45
1751;18.639.571;192.168.100.17;52.113.194.132;TLSv1.2;153;Application Data;;;;;;;;;18639571,24
1752;19.043.411;192.168.100.17;52.113.194.132;TLSv1.2;1197;Application Data;;;;;;;;;19043411,02
1753;19.447.251;52.113.194.132;192.168.100.17;TCP;56;443  >  63201 [ACK] Seq=155 Ack=624 Win=524544 Len=0;;;;;;;;;19447250,81
1754;19.851.091;52.113.194.132;192.168.100.17;TLSv1.2;123;Application Data;;;;;;;;;19851090,59
1755;20.254.930;52.113.194.132;192.168.100.17;TCP;56;443  >  63201 [ACK] Seq=224 Ack=723 Win=524288 Len=0;;;;;;;;;20254930,37
1756;20.658.770;192.168.100.17;52.113.194.132;TLSv1.2;92;Application Data;;;;;;;;;20658770,16
1757;21.062.610;52.113.194.132;192.168.100.17;TLSv1.2;92;Application Data;;;;;;;;;21062609,94
1758;21.466.450;52.113.194.132;192.168.100.17;TCP;56;443  >  63201 [ACK] Seq=262 Ack=1904 Win=525056 Len=0;;;;;;;;;21466449,73
1759;21.870.290;192.168.100.17;52.113.194.132;TCP;54;63201  >  443 [ACK] Seq=1904 Ack=262 Win=130816 Len=0;;;;;;;;;21870289,51
1760;22.275.565;52.113.194.132;192.168.100.17;TLSv1.2;399;Application Data;;;;;;;;;22275565
1761;22.275.565;52.113.194.132;192.168.100.17;TLSv1.2;183;Application Data;;;;;;;;;22275565
1762;22.275.565;52.113.194.132;192.168.100.17;TLSv1.2;92;Application Data;;;;;;;;;22275565
1763;22.275.672;192.168.100.17;52.113.194.132;TCP;54;63201  >  443 [ACK] Seq=1904 Ack=774 Win=130304 Len=0;;;;;;;;;22275672
1768;22.348.154;192.168.100.17;40.74.79.81;TCP;66;63202  >  443 [SYN] Seq=0 Win=64240 Len=0 MSS=1460 WS=256 SACK_PERM=1;;;;;;;;;22348154
1769;22.441.638;40.74.79.81;192.168.100.17;TCP;66;443  >  63202 [SYN, ACK] Seq=0 Ack=1 Win=65535 Len=0 MSS=1412 WS=256 SACK_PERM=1;;;;;;;;;22441638
1770;22.441.807;192.168.100.17;40.74.79.81;TCP;54;63202  >  443 [ACK] Seq=1 Ack=1 Win=131072 Len=0;;;;;;;;;22441807
1771;22.442.189;192.168.100.17;40.74.79.81;TLSv1.2;571;Client Hello;;;;;;;;;22442189
1772;22.537.422;40.74.79.81;192.168.100.17;TCP;1466;443  >  63202 [ACK] Seq=1 Ack=518 Win=524544 Len=1412 [TCP segment of a reassembled PDU];;;;;;;;;22537422
1773;22.537.422;40.74.79.81;192.168.100.17;TCP;1466;443  >  63202 [ACK] Seq=1413 Ack=518 Win=524544 Len=1412 [TCP segment of a reassembled PDU];;;;;;;;;22537422
1774;22.537.422;40.74.79.81;192.168.100.17;TCP;1466;443  >  63202 [ACK] Seq=2825 Ack=518 Win=524544 Len=1412 [TCP segment of a reassembled PDU];;;;;;;;;22537422
1775;22.537.508;192.168.100.17;40.74.79.81;TCP;54;63202  >  443 [ACK] Seq=518 Ack=4237 Win=131072 Len=0;;;;;;;;;22537508
1776;22.540.062;40.74.79.81;192.168.100.17;TCP;1466;443  >  63202 [ACK] Seq=4237 Ack=518 Win=524544 Len=1412 [TCP segment of a reassembled PDU];;;;;;;;;22540062
1777;22.540.062;40.74.79.81;192.168.100.17;TLSv1.2;151;Server Hello, Certificate, Certificate Status, Server Key Exchange, Server Hello Done;;;;;;;;;22540062
1778;22.540.146;192.168.100.17;40.74.79.81;TCP;54;63202  >  443 [ACK] Seq=518 Ack=5746 Win=131072 Len=0;;;;;;;;;22540146
1779;22.548.235;192.168.100.17;40.74.79.81;TLSv1.2;212;Client Key Exchange, Change Cipher Spec, Encrypted Handshake Message;;;;;;;;;22548235
1780;22.548.420;192.168.100.17;40.74.79.81;TLSv1.2;153;Application Data;;;;;;;;;22548420
1781;22.548.550;192.168.100.17;40.74.79.81;TLSv1.2;1073;Application Data;;;;;;;;;22548550
1782;22.639.296;40.74.79.81;192.168.100.17;TCP;56;443  >  63202 [ACK] Seq=5746 Ack=775 Win=524288 Len=0;;;;;;;;;22639296
1783;22.640.923;40.74.79.81;192.168.100.17;TLSv1.2;105;Change Cipher Spec, Encrypted Handshake Message;;;;;;;;;22640923
1784;22.640.923;40.74.79.81;192.168.100.17;TLSv1.2;152;Application Data, Application Data;;;;;;;;;22640923
1785;22.640.983;192.168.100.17;40.74.79.81;TCP;54;63202  >  443 [ACK] Seq=1794 Ack=5895 Win=131072 Len=0;;;;;;;;;22640983
1786;22.641.188;192.168.100.17;40.74.79.81;TLSv1.2;92;Application Data;;;;;;;;;22641188
1787;22.642.427;40.74.79.81;192.168.100.17;TLSv1.2;92;Application Data;;;;;;;;;22642427
1788;22.688.260;192.168.100.17;40.74.79.81;TCP;54;63202  >  443 [ACK] Seq=1832 Ack=5933 Win=131072 Len=0;;;;;;;;;22688260
1789;22.737.466;40.74.79.81;192.168.100.17;TLSv1.2;1055;Application Data;;;;;;;;;22737466
1790;22.737.466;40.74.79.81;192.168.100.17;TLSv1.2;92;Application Data;;;;;;;;;22737466
1791;22.737.532;192.168.100.17;40.74.79.81;TCP;54;63202  >  443 [ACK] Seq=1832 Ack=6972 Win=130048 Len=0;;;;;;;;;22737532
1792;22.781.332;40.74.79.81;192.168.100.17;TCP;56;443  >  63202 [ACK] Seq=6972 Ack=1832 Win=525056 Len=0;;;;;;;;;22781332
1793;25.977.990;192.168.100.17;74.125.200.103;TCP;55;63199  >  443 [ACK] Seq=1 Ack=1 Win=64952 Len=1 [TCP segment of a reassembled PDU];;;;;;;;;25977990
1794;26.004.540;74.125.200.103;192.168.100.17;TCP;54;443  >  63199 [ACK] Seq=1 Ack=2 Win=65535 Len=0;;;;;;;;;26004540
1798;28.009.527;192.168.100.17;31.13.95.60;TCP;66;63203  >  443 [SYN] Seq=0 Win=64240 Len=0 MSS=1460 WS=256 SACK_PERM=1;;;;;;;;;28009527
1799;28.024.309;31.13.95.60;192.168.100.17;TCP;58;443  >  63203 [SYN, ACK] Seq=0 Ack=1 Win=4380 Len=0 MSS=1412;;;;;;;;;28024309
1800;28.024.385;192.168.100.17;31.13.95.60;TCP;54;63203  >  443 [ACK] Seq=1 Ack=1 Win=64240 Len=0;;;;;;;;;28024385
1801;28.024.670;192.168.100.17;31.13.95.60;TLSv1.3;571;Client Hello;;;;;;;;;28024670
1802;28.037.869;31.13.95.60;192.168.100.17;TCP;58;[TCP Window Update] 443  >  63203 [ACK] Seq=1 Ack=1 Win=65535 Len=0;;;;;;;;;28037869
1803;28.038.892;31.13.95.60;192.168.100.17;TCP;56;[TCP Dup ACK 1799#1] 443  >  63203 [ACK] Seq=1 Ack=1 Win=65535 Len=0;;;;;;;;;28038892
1804;28.247.857;192.168.100.17;31.13.95.60;TCP;571;[TCP Retransmission] 63203  >  443 [PSH, ACK] Seq=1 Ack=1 Win=64240 Len=517;;;;;;;;;28247857
1805;28.277.332;31.13.95.60;192.168.100.17;TCP;56;443  >  63203 [ACK] Seq=1 Ack=518 Win=65535 Len=0;;;;;;;;;28277332
1806;28.278.772;31.13.95.60;192.168.100.17;TLSv1.3;266;Server Hello, Change Cipher Spec, Application Data;;;;;;;;;28278772
1807;28.279.401;192.168.100.17;31.13.95.60;TLSv1.3;118;Change Cipher Spec, Application Data;;;;;;;;;28279401
1808;28.279.629;192.168.100.17;31.13.95.60;TLSv1.3;146;Application Data;;;;;;;;;28279629
1809;28.279.880;192.168.100.17;31.13.95.60;TLSv1.3;362;Application Data;;;;;;;;;28279880
1810;28.280.071;192.168.100.17;31.13.95.60;TCP;1466;63203  >  443 [ACK] Seq=982 Ack=213 Win=64028 Len=1412 [TCP segment of a reassembled PDU];;;;;;;;;28280071
1811;28.280.071;192.168.100.17;31.13.95.60;TLSv1.3;236;Application Data;;;;;;;;;28280071
1812;28.305.715;31.13.95.60;192.168.100.17;TCP;56;443  >  63203 [ACK] Seq=213 Ack=582 Win=65535 Len=0;;;;;;;;;28305715
1813;28.305.849;31.13.95.60;192.168.100.17;TCP;56;443  >  63203 [ACK] Seq=213 Ack=674 Win=65535 Len=0;;;;;;;;;28305849
1814;28.323.054;31.13.95.60;192.168.100.17;TCP;56;443  >  63203 [ACK] Seq=213 Ack=982 Win=65535 Len=0;;;;;;;;;28323054
1815;28.323.054;31.13.95.60;192.168.100.17;TCP;56;[TCP Dup ACK 1814#1] 443  >  63203 [ACK] Seq=213 Ack=982 Win=65535 Len=0;;;;;;;;;28323054
1816;28.323.054;31.13.95.60;192.168.100.17;TCP;56;443  >  63203 [ACK] Seq=213 Ack=2576 Win=65535 Len=0;;;;;;;;;28323054
1817;28.323.054;31.13.95.60;192.168.100.17;TLSv1.3;225;Application Data;;;;;;;;;28323054
1818;28.323.054;31.13.95.60;192.168.100.17;TLSv1.3;134;Application Data;;;;;;;;;28323054
1819;28.323.054;31.13.95.60;192.168.100.17;TLSv1.3;98;Application Data;;;;;;;;;28323054
1820;28.323.237;192.168.100.17;31.13.95.60;TCP;54;63203  >  443 [ACK] Seq=2576 Ack=508 Win=63733 Len=0;;;;;;;;;28323237
1821;28.323.621;192.168.100.17;31.13.95.60;TLSv1.3;85;Application Data;;;;;;;;;28323621
1822;28.337.049;31.13.95.60;192.168.100.17;TCP;56;443  >  63203 [ACK] Seq=508 Ack=2607 Win=65535 Len=0;;;;;;;;;28337049
1823;28.727.267;31.13.95.60;192.168.100.17;TLSv1.3;324;Application Data;;;;;;;;;28727267
1824;28.727.267;31.13.95.60;192.168.100.17;TCP;324;[TCP Retransmission] 443  >  63203 [PSH, ACK] Seq=508 Ack=2607 Win=65535 Len=270;;;;;;;;;28727267
1825;28.727.334;192.168.100.17;31.13.95.60;TCP;54;63203  >  443 [ACK] Seq=2607 Ack=778 Win=64952 Len=0;;;;;;;;;28727334
1826;28.921.160;192.168.100.17;35.186.224.39;TLSv1.2;97;Application Data;;;;;;;;;28921160
1827;28.936.057;35.186.224.39;192.168.100.17;TCP;56;443  >  65458 [ACK] Seq=1 Ack=44 Win=272 Len=0;;;;;;;;;28936057
1828;28.994.472;35.186.224.39;192.168.100.17;TLSv1.2;94;Application Data;;;;;;;;;28994472
1829;29.048.014;192.168.100.17;35.186.224.39;TCP;54;65458  >  443 [ACK] Seq=44 Ack=41 Win=510 Len=0;;;;;;;;;29048014
1832;30.121.590;192.168.100.17;35.186.224.47;TLSv1.2;97;Application Data;;;;;;;;;30121590
1833;30.137.224;35.186.224.47;192.168.100.17;TCP;54;443  >  65379 [ACK] Seq=41 Ack=87 Win=272 Len=0;;;;;;;;;30137224
1834;30.198.605;35.186.224.47;192.168.100.17;TLSv1.2;94;Application Data;;;;;;;;;30198605
1835;30.245.746;192.168.100.17;35.186.224.47;TCP;54;65379  >  443 [ACK] Seq=87 Ack=81 Win=255 Len=0;;;;;;;;;30245746
1836;32.570.041;192.168.100.17;74.125.200.103;TCP;55;63196  >  443 [ACK] Seq=1 Ack=1 Win=64952 Len=1 [TCP segment of a reassembled PDU];;;;;;;;;32570041
1837;32.597.740;74.125.200.103;192.168.100.17;TCP;54;443  >  63196 [ACK] Seq=1 Ack=2 Win=65535 Len=0;;;;;;;;;32597740
1838;33.516.740;192.168.100.17;35.186.224.47;TLSv1.2;89;Application Data;;;;;;;;;33516740
1839;33.537.448;35.186.224.47;192.168.100.17;TCP;56;443  >  65461 [ACK] Seq=32 Ack=71 Win=266 Len=0;;;;;;;;;33537448
1840;33.596.393;35.186.224.47;192.168.100.17;TLSv1.2;85;Application Data;;;;;;;;;33596393
1841;33.648.790;192.168.100.17;35.186.224.47;TCP;54;65461  >  443 [ACK] Seq=71 Ack=63 Win=509 Len=0;;;;;;;;;33648790
1842;35.870.694;192.168.100.17;199.232.44.84;TCP;55;63112  >  443 [ACK] Seq=1 Ack=1 Win=63579 Len=1 [TCP segment of a reassembled PDU];;;;;;;;;35870694
1843;35.900.661;199.232.44.84;192.168.100.17;TCP;56;443  >  63112 [ACK] Seq=1 Ack=2 Win=65535 Len=0;;;;;;;;;35900661
1844;38.659.866;35.186.224.39;192.168.100.17;TLSv1.2;445;Application Data;;;;;;;;;38659866
1845;38.707.284;192.168.100.17;35.186.224.39;TCP;54;65458  >  443 [ACK] Seq=44 Ack=432 Win=509 Len=0;;;;;;;;;38707284
1846;38.721.071;192.168.100.17;35.186.224.25;TLSv1.2;150;Ignored Unknown Record;;;;;;;;;38721071
1847;38.721.234;192.168.100.17;35.186.224.25;TLSv1.2;93;Application Data;;;;;;;;;38721234
1848;38.756.029;35.186.224.25;192.168.100.17;TLSv1.2;93;Application Data;;;;;;;;;38756029
1849;38.756.029;35.186.224.25;192.168.100.17;TCP;56;443  >  55370 [ACK] Seq=1 Ack=98 Win=597 Len=0;;;;;;;;;38756029
1850;38.756.157;192.168.100.17;35.186.224.25;TCP;54;55370  >  443 [ACK] Seq=137 Ack=40 Win=508 Len=0;;;;;;;;;38756157
1851;38.760.673;35.186.224.25;192.168.100.17;TCP;56;443  >  55370 [ACK] Seq=1 Ack=137 Win=597 Len=0;;;;;;;;;38760673
1852;38.760.716;192.168.100.17;35.186.224.25;TCP;54;[TCP Dup ACK 1850#1] 55370  >  443 [ACK] Seq=137 Ack=40 Win=508 Len=0;;;;;;;;;38760716
1853;38.823.046;35.186.224.25;192.168.100.17;TLSv1.2;129;Application Data;;;;;;;;;38823046
1854;38.823.046;35.186.224.25;192.168.100.17;TLSv1.2;513;Application Data;;;;;;;;;38823046
1855;38.823.046;35.186.224.25;192.168.100.17;TLSv1.2;176;Application Data;;;;;;;;;38823046
1856;38.823.046;35.186.224.25;192.168.100.17;TLSv1.2;93;Application Data;;;;;;;;;38823046
1857;38.823.161;192.168.100.17;35.186.224.25;TCP;54;55370  >  443 [ACK] Seq=137 Ack=735 Win=512 Len=0;;;;;;;;;38823161
1858;38.824.046;192.168.100.17;35.186.224.25;TLSv1.2;93;Application Data;;;;;;;;;38824046
1859;38.834.849;192.168.100.17;35.186.224.13;TLSv1.2;140;Ignored Unknown Record;;;;;;;;;38834849
1860;38.834.985;192.168.100.17;35.186.224.13;TLSv1.2;93;Application Data;;;;;;;;;38834985
1861;38.835.037;192.168.100.17;35.186.224.13;TLSv1.2;703;Application Data;;;;;;;;;38835037
1862;38.835.546;192.168.100.17;35.186.224.13;TLSv1.2;136;Application Data;;;;;;;;;38835546
1863;38.835.683;192.168.100.17;35.186.224.13;TLSv1.2;675;Application Data;;;;;;;;;38835683
1864;38.856.227;35.186.224.25;192.168.100.17;TCP;56;443  >  55370 [ACK] Seq=735 Ack=176 Win=597 Len=0;;;;;;;;;38856227
1865;38.863.284;35.186.224.13;192.168.100.17;TCP;56;443  >  65460 [ACK] Seq=1 Ack=88 Win=736 Len=0;;;;;;;;;38863284
1866;38.864.346;35.186.224.13;192.168.100.17;TLSv1.2;93;Application Data;;;;;;;;;38864346
1867;38.864.346;35.186.224.13;192.168.100.17;TCP;56;443  >  65460 [ACK] Seq=1 Ack=127 Win=736 Len=0;;;;;;;;;38864346
1868;38.864.346;35.186.224.13;192.168.100.17;TCP;56;443  >  65460 [ACK] Seq=1 Ack=776 Win=747 Len=0;;;;;;;;;38864346
1869;38.864.346;35.186.224.13;192.168.100.17;TCP;56;443  >  65460 [ACK] Seq=1 Ack=858 Win=747 Len=0;;;;;;;;;38864346
1870;38.864.346;35.186.224.13;192.168.100.17;TCP;56;443  >  65460 [ACK] Seq=1 Ack=1479 Win=758 Len=0;;;;;;;;;38864346
1871;38.864.435;192.168.100.17;35.186.224.13;TCP;54;65460  >  443 [ACK] Seq=1479 Ack=40 Win=508 Len=0;;;;;;;;;38864435
1872;38.864.503;192.168.100.17;35.186.224.13;TCP;54;[TCP Dup ACK 1871#1] 65460  >  443 [ACK] Seq=1479 Ack=40 Win=508 Len=0;;;;;;;;;38864503
1873;38.864.524;192.168.100.17;35.186.224.13;TCP;54;[TCP Dup ACK 1871#2] 65460  >  443 [ACK] Seq=1479 Ack=40 Win=508 Len=0;;;;;;;;;38864524
1874;38.864.543;192.168.100.17;35.186.224.13;TCP;54;[TCP Dup ACK 1871#3] 65460  >  443 [ACK] Seq=1479 Ack=40 Win=508 Len=0;;;;;;;;;38864543
1875;38.941.804;35.186.224.13;192.168.100.17;TLSv1.2;125;Application Data;;;;;;;;;38941804
1876;38.941.804;35.186.224.13;192.168.100.17;TLSv1.2;174;Application Data;;;;;;;;;38941804
1877;38.941.804;35.186.224.13;192.168.100.17;TLSv1.2;194;Application Data;;;;;;;;;38941804
1878;38.941.804;35.186.224.13;192.168.100.17;TLSv1.2;93;Application Data;;;;;;;;;38941804
1879;38.941.948;192.168.100.17;35.186.224.13;TCP;54;65460  >  443 [ACK] Seq=1479 Ack=410 Win=512 Len=0;;;;;;;;;38941948
1880;38.942.903;192.168.100.17;35.186.224.13;TLSv1.2;93;Application Data;;;;;;;;;38942903
1881;38.947.669;35.186.224.13;192.168.100.17;TLSv1.2;125;Application Data;;;;;;;;;38947669
1882;38.947.669;35.186.224.13;192.168.100.17;TLSv1.2;321;Application Data;;;;;;;;;38947669
1883;38.947.761;192.168.100.17;35.186.224.13;TCP;54;65460  >  443 [ACK] Seq=1518 Ack=748 Win=511 Len=0;;;;;;;;;38947761
1884;38.948.034;35.186.224.13;192.168.100.17;TLSv1.2;91;Application Data;;;;;;;;;38948034
1885;38.955.587;192.168.100.17;35.186.224.13;TLSv1.2;140;Application Data;;;;;;;;;38955587
1886;38.955.717;192.168.100.17;35.186.224.13;TLSv1.2;703;Application Data;;;;;;;;;38955717
1887;38.956.221;192.168.100.17;35.186.224.13;TLSv1.2;136;Application Data;;;;;;;;;38956221
1888;38.956.311;192.168.100.17;35.186.224.13;TLSv1.2;667;Application Data;;;;;;;;;38956311
1889;38.964.106;192.168.100.17;185.184.8.65;TCP;55;63120  >  443 [ACK] Seq=1 Ack=1 Win=63718 Len=1 [TCP segment of a reassembled PDU];;;;;;;;;38964106
1890;38.975.260;35.186.224.13;192.168.100.17;TCP;56;443  >  65460 [ACK] Seq=785 Ack=1518 Win=758 Len=0;;;;;;;;;38975260
1891;38.985.400;35.186.224.13;192.168.100.17;TCP;66;443  >  65460 [ACK] Seq=785 Ack=1604 Win=769 Len=0 SLE=2253 SRE=2335;;;;;;;;;38985400
1892;38.986.121;35.186.224.13;192.168.100.17;TCP;56;443  >  65460 [ACK] Seq=785 Ack=2335 Win=780 Len=0;;;;;;;;;38986121
1893;38.988.322;35.186.224.13;192.168.100.17;TCP;56;443  >  65460 [ACK] Seq=785 Ack=2948 Win=791 Len=0;;;;;;;;;38988322
1894;39.078.018;35.186.224.13;192.168.100.17;TLSv1.2;125;Application Data;;;;;;;;;39078018
1895;39.078.018;35.186.224.13;192.168.100.17;TLSv1.2;315;Application Data;;;;;;;;;39078018
1896;39.078.018;35.186.224.13;192.168.100.17;TLSv1.2;157;Application Data;;;;;;;;;39078018
1897;39.078.132;192.168.100.17;35.186.224.13;TCP;54;65460  >  443 [ACK] Seq=2948 Ack=1220 Win=509 Len=0;;;;;;;;;39078132
1898;39.079.477;35.186.224.13;192.168.100.17;TLSv1.2;93;Application Data;;;;;;;;;39079477
1899;39.079.570;192.168.100.17;35.186.224.13;TCP;54;65460  >  443 [ACK] Seq=2948 Ack=1259 Win=509 Len=0;;;;;;;;;39079570
1900;39.080.719;192.168.100.17;35.186.224.13;TLSv1.2;93;Application Data;;;;;;;;;39080719
1901;39.109.711;35.186.224.13;192.168.100.17;TLSv1.2;125;Application Data;;;;;;;;;39109711
1902;39.110.936;35.186.224.13;192.168.100.17;TLSv1.2;229;Application Data;;;;;;;;;39110936
1903;39.110.936;35.186.224.13;192.168.100.17;TLSv1.2;213;Application Data;;;;;;;;;39110936
1904;39.111.010;192.168.100.17;35.186.224.13;TCP;54;65460  >  443 [ACK] Seq=2987 Ack=1664 Win=508 Len=0;;;;;;;;;39111010
1905;39.111.158;35.186.224.13;192.168.100.17;TCP;56;443  >  65460 [ACK] Seq=1664 Ack=2987 Win=791 Len=0;;;;;;;;;39111158
1906;39.141.983;185.184.8.65;192.168.100.17;TCP;56;443  >  63120 [ACK] Seq=1 Ack=2 Win=63784 Len=0;;;;;;;;;39141983
1927;43.244.859;192.168.100.17;74.125.24.188;TCP;55;55327  >  5228 [ACK] Seq=1 Ack=1 Win=64278 Len=1;;;;;;;;;43244859
1928;43.277.077;74.125.24.188;192.168.100.17;TCP;54;5228  >  55327 [ACK] Seq=1 Ack=2 Win=65535 Len=0;;;;;;;;;43277077
1929;43.925.604;192.168.100.17;157.240.208.60;TLSv1.2;85;Application Data;;;;;;;;;43925604
1930;43.941.398;157.240.208.60;192.168.100.17;TCP;56;443  >  63179 [ACK] Seq=39 Ack=63 Win=65535 Len=0;;;;;;;;;43941398
1931;44.188.457;157.240.208.60;192.168.100.17;TLSv1.2;92;Application Data;;;;;;;;;44188457
1932;44.241.917;192.168.100.17;157.240.208.60;TCP;54;63179  >  443 [ACK] Seq=63 Ack=77 Win=64005 Len=0;;;;;;;;;44241917
1933;44.375.374;192.168.100.17;151.101.54.49;TCP;55;63135  >  443 [ACK] Seq=1 Ack=1 Win=64952 Len=1 [TCP segment of a reassembled PDU];;;;;;;;;44375374
1934;44.598.662;151.101.54.49;192.168.100.17;TCP;54;443  >  63135 [ACK] Seq=1 Ack=2 Win=65535 Len=0;;;;;;;;;44598662
1945;45.419.827;104.199.240.237;192.168.100.17;SSL;65;Continuation Data;;;;;;;;;45419827
1948;45.464.808;192.168.100.17;104.199.240.237;TCP;54;63071  >  443 [ACK] Seq=1 Ack=12 Win=512 Len=0;;;;;;;;;45464808
1977;46.673.633;192.168.100.17;35.186.224.25;TCP;55;[TCP Keep-Alive] 55359  >  443 [ACK] Seq=687 Ack=126 Win=512 Len=1;;;;;;;;;46673633
1978;46.700.327;35.186.224.25;192.168.100.17;TCP;66;[TCP Keep-Alive ACK] 443  >  55359 [ACK] Seq=126 Ack=688 Win=1048 Len=0 SLE=687 SRE=688;;;;;;;;;46700327
1979;47.492.832;192.168.100.17;20.197.71.89;TLSv1.2;97;Application Data;;;;;;;;;47492832
1980;47.521.511;20.197.71.89;192.168.100.17;TLSv1.2;228;Application Data;;;;;;;;;47521511
1981;47.565.992;192.168.100.17;20.197.71.89;TCP;54;63072  >  443 [ACK] Seq=87 Ack=349 Win=257 Len=0;;;;;;;;;47565992
1982;48.991.245;192.168.100.17;52.163.231.110;TLSv1.2;112;Application Data;;;;;;;;;48991245
1983;48.995.268;13.67.74.235;192.168.100.17;TLSv1.2;352;Application Data;;;;;;;;;48995268
1984;48.996.257;192.168.100.17;13.67.74.235;TLSv1.2;96;Application Data;;;;;;;;;48996257
1985;49.000.806;192.168.100.17;13.67.74.235;TLSv1.2;219;Application Data;;;;;;;;;49000806
1986;49.020.950;52.163.231.110;192.168.100.17;TLSv1.2;101;Application Data;;;;;;;;;49020950
1987;49.028.377;13.67.74.235;192.168.100.17;TCP;54;443  >  63080 [ACK] Seq=598 Ack=415 Win=2049 Len=0;;;;;;;;;49028377
1988;49.067.734;192.168.100.17;52.163.231.110;TCP;54;63081  >  443 [ACK] Seq=117 Ack=95 Win=256 Len=0;;;;;;;;;49067734
1991;49.700.595;192.168.100.17;52.113.194.132;TCP;66;63204  >  443 [SYN] Seq=0 Win=64240 Len=0 MSS=1460 WS=256 SACK_PERM=1;;;;;;;;;49700595
1992;49.728.373;52.113.194.132;192.168.100.17;TCP;66;443  >  63204 [SYN, ACK] Seq=0 Ack=1 Win=65535 Len=0 MSS=1412 WS=256 SACK_PERM=1;;;;;;;;;49728373
1993;49.728.468;192.168.100.17;52.113.194.132;TCP;54;63204  >  443 [ACK] Seq=1 Ack=1 Win=131072 Len=0;;;;;;;;;49728468
1994;49.730.144;192.168.100.17;52.113.194.132;TLSv1.2;233;Client Hello;;;;;;;;;49730144
1995;49.761.429;52.113.194.132;192.168.100.17;TCP;54;443  >  63204 [ACK] Seq=1 Ack=180 Win=525056 Len=0;;;;;;;;;49761429
1996;49.767.650;52.113.194.132;192.168.100.17;TCP;1466;443  >  63204 [ACK] Seq=1 Ack=180 Win=525056 Len=1412 [TCP segment of a reassembled PDU];;;;;;;;;49767650
1997;49.773.929;52.113.194.132;192.168.100.17;TCP;1466;443  >  63204 [ACK] Seq=1413 Ack=180 Win=525056 Len=1412 [TCP segment of a reassembled PDU];;;;;;;;;49773929
1998;49.773.929;52.113.194.132;192.168.100.17;TCP;1466;443  >  63204 [ACK] Seq=2825 Ack=180 Win=525056 Len=1412 [TCP segment of a reassembled PDU];;;;;;;;;49773929
1999;49.773.929;52.113.194.132;192.168.100.17;TCP;1466;443  >  63204 [ACK] Seq=4237 Ack=180 Win=525056 Len=1412 [TCP segment of a reassembled PDU];;;;;;;;;49773929
2000;49.773.929;52.113.194.132;192.168.100.17;TLSv1.2;406;Server Hello, Certificate, Certificate Status, Server Key Exchange, Server Hello Done;;;;;;;;;49773929
2001;49.774.006;192.168.100.17;52.113.194.132;TCP;54;63204  >  443 [ACK] Seq=180 Ack=6001 Win=131072 Len=0;;;;;;;;;49774006
2002;49.778.233;192.168.100.17;52.113.194.132;TLSv1.2;212;Client Key Exchange, Change Cipher Spec, Encrypted Handshake Message;;;;;;;;;49778233
2003;49.804.581;52.113.194.132;192.168.100.17;TCP;56;443  >  63204 [ACK] Seq=6001 Ack=338 Win=524800 Len=0;;;;;;;;;49804581
2004;49.806.309;52.113.194.132;192.168.100.17;TLSv1.2;380;New Session Ticket, Change Cipher Spec, Encrypted Handshake Message;;;;;;;;;49806309
2005;49.812.922;192.168.100.17;52.113.194.132;TCP;1466;63204  >  443 [ACK] Seq=338 Ack=6327 Win=130816 Len=1412 [TCP segment of a reassembled PDU];;;;;;;;;49812922
2006;49.812.922;192.168.100.17;52.113.194.132;TLSv1.2;362;Application Data;;;;;;;;;49812922
2007;49.841.038;52.113.194.132;192.168.100.17;TCP;56;443  >  63204 [ACK] Seq=6327 Ack=1750 Win=525056 Len=0;;;;;;;;;49841038
2008;49.841.238;52.113.194.132;192.168.100.17;TCP;56;443  >  63204 [ACK] Seq=6327 Ack=2058 Win=524800 Len=0;;;;;;;;;49841238
2011;49.882.017;192.168.100.17;52.109.56.20;TCP;66;63205  >  443 [SYN] Seq=0 Win=64240 Len=0 MSS=1460 WS=256 SACK_PERM=1;;;;;;;;;49882017
2012;49.957.830;52.109.56.20;192.168.100.17;TCP;66;443  >  63205 [SYN, ACK] Seq=0 Ack=1 Win=65535 Len=0 MSS=1412 WS=256 SACK_PERM=1;;;;;;;;;49957830
2013;49.957.903;192.168.100.17;52.109.56.20;TCP;54;63205  >  443 [ACK] Seq=1 Ack=1 Win=131072 Len=0;;;;;;;;;49957903
2014;49.958.452;192.168.100.17;52.109.56.20;TLSv1.2;246;Client Hello;;;;;;;;;49958452
2032;50.029.134;192.168.100.17;52.109.124.47;TCP;66;63206  >  443 [SYN] Seq=0 Win=64240 Len=0 MSS=1460 WS=256 SACK_PERM=1;;;;;;;;;50029134
2033;50.029.344;192.168.100.17;52.109.124.47;TCP;66;63207  >  443 [SYN] Seq=0 Win=64240 Len=0 MSS=1460 WS=256 SACK_PERM=1;;;;;;;;;50029344
2035;50.029.550;192.168.100.17;52.109.124.47;TCP;66;63208  >  443 [SYN] Seq=0 Win=64240 Len=0 MSS=1460 WS=256 SACK_PERM=1;;;;;;;;;50029550
2047;50.038.392;52.109.56.20;192.168.100.17;TCP;1466;443  >  63205 [ACK] Seq=1 Ack=193 Win=525056 Len=1412 [TCP segment of a reassembled PDU];;;;;;;;;50038392
2048;50.038.392;52.109.56.20;192.168.100.17;TCP;1466;443  >  63205 [ACK] Seq=1413 Ack=193 Win=525056 Len=1412 [TCP segment of a reassembled PDU];;;;;;;;;50038392
2049;50.038.392;52.109.56.20;192.168.100.17;TCP;1466;443  >  63205 [ACK] Seq=2825 Ack=193 Win=525056 Len=1412 [TCP segment of a reassembled PDU];;;;;;;;;50038392
2050;50.038.392;52.109.56.20;192.168.100.17;TCP;1466;443  >  63205 [ACK] Seq=4237 Ack=193 Win=525056 Len=1412 [TCP segment of a reassembled PDU];;;;;;;;;50038392
2051;50.038.392;52.109.56.20;192.168.100.17;TLSv1.2;339;Server Hello, Certificate, Certificate Status, Server Key Exchange, Server Hello Done;;;;;;;;;50038392
2052;50.038.463;192.168.100.17;52.109.56.20;TCP;54;63205  >  443 [ACK] Seq=193 Ack=5934 Win=131072 Len=0;;;;;;;;;50038463
2066;50.048.024;192.168.100.17;52.109.56.20;TLSv1.2;212;Client Key Exchange, Change Cipher Spec, Encrypted Handshake Message;;;;;;;;;50048024
2147;50.072.211;52.109.124.47;192.168.100.17;TCP;66;443  >  63207 [SYN, ACK] Seq=0 Ack=1 Win=65535 Len=0 MSS=1412 WS=256 SACK_PERM=1;;;;;;;;;50072211
2148;50.072.211;52.109.124.47;192.168.100.17;TCP;66;443  >  63206 [SYN, ACK] Seq=0 Ack=1 Win=65535 Len=0 MSS=1412 WS=256 SACK_PERM=1;;;;;;;;;50072211
2149;50.072.211;52.109.124.47;192.168.100.17;TCP;66;443  >  63208 [SYN, ACK] Seq=0 Ack=1 Win=65535 Len=0 MSS=1412 WS=256 SACK_PERM=1;;;;;;;;;50072211
2154;50.072.401;192.168.100.17;52.109.124.47;TCP;54;63207  >  443 [ACK] Seq=1 Ack=1 Win=131072 Len=0;;;;;;;;;50072401
2155;50.072.446;192.168.100.17;52.109.124.47;TCP;54;63206  >  443 [ACK] Seq=1 Ack=1 Win=131072 Len=0;;;;;;;;;50072446
2156;50.072.459;192.168.100.17;52.109.124.47;TCP;54;63208  >  443 [ACK] Seq=1 Ack=1 Win=131072 Len=0;;;;;;;;;50072459
2162;50.072.906;192.168.100.17;52.109.124.47;TLSv1.2;243;Client Hello;;;;;;;;;50072906
2164;50.072.959;192.168.100.17;52.109.124.47;TLSv1.2;243;Client Hello;;;;;;;;;50072959
2165;50.072.998;192.168.100.17;52.109.124.47;TLSv1.2;243;Client Hello;;;;;;;;;50072998
2221;50.085.474;192.168.100.17;119.110.115.146;TCP;66;63209  >  443 [SYN] Seq=0 Win=64240 Len=0 MSS=1460 WS=256 SACK_PERM=1;;;;;;;;;50085474
2305;50.109.101;119.110.115.146;192.168.100.17;TCP;58;443  >  63209 [SYN, ACK] Seq=0 Ack=1 Win=4380 Len=0 MSS=1412;;;;;;;;;50109101
2306;50.109.321;192.168.100.17;119.110.115.146;TCP;54;63209  >  443 [ACK] Seq=1 Ack=1 Win=64240 Len=0;;;;;;;;;50109321
2309;50.109.823;192.168.100.17;119.110.115.146;TLSv1.2;252;Client Hello;;;;;;;;;50109823
2310;50.114.465;52.109.124.47;192.168.100.17;TCP;1466;443  >  63208 [ACK] Seq=1 Ack=190 Win=525056 Len=1412 [TCP segment of a reassembled PDU];;;;;;;;;50114465
2311;50.129.037;52.109.124.47;192.168.100.17;TCP;1466;443  >  63208 [ACK] Seq=1413 Ack=190 Win=525056 Len=1412 [TCP segment of a reassembled PDU];;;;;;;;;50129037
2312;50.129.037;52.109.124.47;192.168.100.17;TCP;1466;443  >  63208 [ACK] Seq=2825 Ack=190 Win=525056 Len=1412 [TCP segment of a reassembled PDU];;;;;;;;;50129037
2313;50.129.037;52.109.124.47;192.168.100.17;TCP;1466;443  >  63208 [ACK] Seq=4237 Ack=190 Win=525056 Len=1412 [TCP segment of a reassembled PDU];;;;;;;;;50129037
2314;50.129.037;52.109.124.47;192.168.100.17;TLSv1.2;281;Server Hello, Certificate, Certificate Status, Server Key Exchange, Server Hello Done;;;;;;;;;50129037
2315;50.129.037;52.109.124.47;192.168.100.17;TCP;1466;443  >  63207 [ACK] Seq=1 Ack=190 Win=525056 Len=1412 [TCP segment of a reassembled PDU];;;;;;;;;50129037
2316;50.129.037;52.109.124.47;192.168.100.17;TCP;1466;443  >  63207 [ACK] Seq=1413 Ack=190 Win=525056 Len=1412 [TCP segment of a reassembled PDU];;;;;;;;;50129037
2317;50.129.037;52.109.124.47;192.168.100.17;TCP;1466;443  >  63207 [ACK] Seq=2825 Ack=190 Win=525056 Len=1412 [TCP segment of a reassembled PDU];;;;;;;;;50129037
2318;50.129.037;52.109.124.47;192.168.100.17;TCP;1466;443  >  63207 [ACK] Seq=4237 Ack=190 Win=525056 Len=1412 [TCP segment of a reassembled PDU];;;;;;;;;50129037
2319;50.129.037;52.109.124.47;192.168.100.17;TLSv1.2;281;Server Hello, Certificate, Certificate Status, Server Key Exchange, Server Hello Done;;;;;;;;;50129037
2320;50.129.037;52.109.124.47;192.168.100.17;TCP;1466;443  >  63206 [ACK] Seq=1 Ack=190 Win=525056 Len=1412 [TCP segment of a reassembled PDU];;;;;;;;;50129037
2321;50.129.037;52.109.124.47;192.168.100.17;TCP;1466;443  >  63206 [ACK] Seq=1413 Ack=190 Win=525056 Len=1412 [TCP segment of a reassembled PDU];;;;;;;;;50129037
2322;50.129.037;52.109.124.47;192.168.100.17;TCP;1466;443  >  63206 [ACK] Seq=2825 Ack=190 Win=525056 Len=1412 [TCP segment of a reassembled PDU];;;;;;;;;50129037
2323;50.129.037;52.109.124.47;192.168.100.17;TCP;1466;443  >  63206 [ACK] Seq=4237 Ack=190 Win=525056 Len=1412 [TCP segment of a reassembled PDU];;;;;;;;;50129037
2324;50.129.037;52.109.124.47;192.168.100.17;TLSv1.2;281;Server Hello, Certificate, Certificate Status, Server Key Exchange, Server Hello Done;;;;;;;;;50129037
2326;50.129.179;192.168.100.17;52.109.124.47;TCP;54;63208  >  443 [ACK] Seq=190 Ack=5649 Win=131072 Len=0;;;;;;;;;50129179
2327;50.129.246;192.168.100.17;52.109.124.47;TCP;54;63207  >  443 [ACK] Seq=190 Ack=5649 Win=131072 Len=0;;;;;;;;;50129246
2328;50.129.258;192.168.100.17;52.109.124.47;TCP;54;63206  >  443 [ACK] Seq=190 Ack=5649 Win=131072 Len=0;;;;;;;;;50129258
2331;50.133.831;192.168.100.17;52.109.124.47;TLSv1.2;212;Client Key Exchange, Change Cipher Spec, Encrypted Handshake Message;;;;;;;;;50133831
2332;50.133.967;192.168.100.17;52.109.124.47;TLSv1.2;212;Client Key Exchange, Change Cipher Spec, Encrypted Handshake Message;;;;;;;;;50133967
2333;50.134.048;192.168.100.17;52.109.124.47;TLSv1.2;212;Client Key Exchange, Change Cipher Spec, Encrypted Handshake Message;;;;;;;;;50134048
2374;50.140.389;52.109.56.20;192.168.100.17;TLSv1.2;105;Change Cipher Spec, Encrypted Handshake Message;;;;;;;;;50140389
2377;50.140.999;192.168.100.17;52.109.56.20;TLSv1.2;393;Application Data;;;;;;;;;50140999
2378;50.141.047;192.168.100.17;52.109.56.20;TCP;1466;63205  >  443 [ACK] Seq=690 Ack=5985 Win=131072 Len=1412 [TCP segment of a reassembled PDU];;;;;;;;;50141047
2379;50.141.047;192.168.100.17;52.109.56.20;TCP;1466;63205  >  443 [ACK] Seq=2102 Ack=5985 Win=131072 Len=1412 [TCP segment of a reassembled PDU];;;;;;;;;50141047
2380;50.141.047;192.168.100.17;52.109.56.20;TCP;1466;63205  >  443 [ACK] Seq=3514 Ack=5985 Win=131072 Len=1412 [TCP segment of a reassembled PDU];;;;;;;;;50141047
2381;50.141.047;192.168.100.17;52.109.56.20;TCP;1466;63205  >  443 [ACK] Seq=4926 Ack=5985 Win=131072 Len=1412 [TCP segment of a reassembled PDU];;;;;;;;;50141047
2382;50.141.047;192.168.100.17;52.109.56.20;TCP;1466;63205  >  443 [ACK] Seq=6338 Ack=5985 Win=131072 Len=1412 [TCP segment of a reassembled PDU];;;;;;;;;50141047
2383;50.141.047;192.168.100.17;52.109.56.20;TLSv1.2;558;Application Data;;;;;;;;;50141047
2429;50.168.062;119.110.115.146;192.168.100.17;TCP;58;[TCP Window Update] 443  >  63209 [ACK] Seq=1 Ack=1 Win=64240 Len=0;;;;;;;;;50168062
2483;50.192.422;119.110.115.146;192.168.100.17;TCP;54;443  >  63209 [RST] Seq=471358636 Win=0 Len=0;;;;;;;;;50192422
2498;50.193.436;52.109.124.47;192.168.100.17;TLSv1.2;105;Change Cipher Spec, Encrypted Handshake Message;;;;;;;;;50193436
2499;50.193.436;52.109.124.47;192.168.100.17;TLSv1.2;105;Change Cipher Spec, Encrypted Handshake Message;;;;;;;;;50193436
2500;50.193.436;52.109.124.47;192.168.100.17;TLSv1.2;105;Change Cipher Spec, Encrypted Handshake Message;;;;;;;;;50193436
2512;50.194.971;192.168.100.17;52.109.124.47;TCP;1466;63207  >  443 [ACK] Seq=348 Ack=5927 Win=130816 Len=1412 [TCP segment of a reassembled PDU];;;;;;;;;50194971
2513;50.194.971;192.168.100.17;52.109.124.47;TLSv1.2;360;Application Data;;;;;;;;;50194971
2514;50.194.992;192.168.100.17;52.109.124.47;TCP;1466;63208  >  443 [ACK] Seq=348 Ack=5927 Win=130816 Len=1412 [TCP segment of a reassembled PDU];;;;;;;;;50194992
2515;50.194.992;192.168.100.17;52.109.124.47;TLSv1.2;426;Application Data;;;;;;;;;50194992
2516;50.195.015;192.168.100.17;52.109.124.47;TCP;1466;63206  >  443 [ACK] Seq=348 Ack=5927 Win=130816 Len=1412 [TCP segment of a reassembled PDU];;;;;;;;;50195015
2517;50.195.015;192.168.100.17;52.109.124.47;TLSv1.2;355;Application Data;;;;;;;;;50195015
2606;50.284.541;192.168.100.17;52.109.124.47;TCP;1466;[TCP Retransmission] 63208  >  443 [PSH, ACK] Seq=720 Ack=5927 Win=130816 Len=1412;;;;;;;;;50284541
2607;50.292.960;192.168.100.17;52.109.124.47;TCP;1466;[TCP Retransmission] 63206  >  443 [PSH, ACK] Seq=649 Ack=5927 Win=130816 Len=1412;;;;;;;;;50292960
2608;50.293.046;192.168.100.17;52.109.124.47;TCP;1466;[TCP Retransmission] 63207  >  443 [PSH, ACK] Seq=654 Ack=5927 Win=130816 Len=1412;;;;;;;;;50293046
2610;50.350.073;192.168.100.17;119.110.115.146;TCP;252;[TCP Retransmission] 63209  >  443 [PSH, ACK] Seq=1 Ack=1 Win=64240 Len=198;;;;;;;;;50350073
2612;50.449.505;192.168.100.17;52.109.56.20;TCP;1466;[TCP Retransmission] 63205  >  443 [PSH, ACK] Seq=6842 Ack=5985 Win=131072 Len=1412;;;;;;;;;50449505
2623;50.599.536;192.168.100.17;52.109.124.47;TCP;1466;[TCP Retransmission] 63208  >  443 [ACK] Seq=348 Ack=5927 Win=130816 Len=1412;;;;;;;;;50599536
2624;50.599.701;192.168.100.17;52.109.124.47;TCP;1466;[TCP Retransmission] 63206  >  443 [ACK] Seq=348 Ack=5927 Win=130816 Len=1412;;;;;;;;;50599701
2625;50.599.717;192.168.100.17;52.109.124.47;TCP;1466;[TCP Retransmission] 63207  >  443 [ACK] Seq=348 Ack=5927 Win=130816 Len=1412;;;;;;;;;50599717
2644;50.603.346;52.109.56.20;192.168.100.17;TCP;56;443  >  63205 [ACK] Seq=5985 Ack=3514 Win=525056 Len=0;;;;;;;;;50603346
2648;50.603.346;52.109.56.20;192.168.100.17;TCP;56;443  >  63205 [ACK] Seq=5985 Ack=4926 Win=525056 Len=0;;;;;;;;;50603346
2649;50.603.346;52.109.56.20;192.168.100.17;TCP;56;443  >  63205 [ACK] Seq=5985 Ack=8254 Win=525056 Len=0;;;;;;;;;50603346
2654;50.603.346;52.109.124.47;192.168.100.17;TCP;56;443  >  63207 [ACK] Seq=5927 Ack=2066 Win=525056 Len=0;;;;;;;;;50603346
2655;50.603.346;52.109.124.47;192.168.100.17;TCP;56;443  >  63208 [ACK] Seq=5927 Ack=2132 Win=525056 Len=0;;;;;;;;;50603346
2672;50.656.047;192.168.100.17;119.110.115.146;TCP;252;[TCP Retransmission] 63209  >  443 [PSH, ACK] Seq=1 Ack=1 Win=64240 Len=198;;;;;;;;;50656047
2690;50.871.834;52.113.194.132;192.168.100.17;TLSv1.2;561;Application Data;;;;;;;;;50871834
2692;50.871.834;52.109.124.47;192.168.100.17;TLSv1.2;988;Application Data;;;;;;;;;50871834
2693;50.871.834;52.109.124.47;192.168.100.17;TLSv1.2;938;Application Data;;;;;;;;;50871834
2694;50.871.834;52.109.124.47;192.168.100.17;TCP;66;[TCP Dup ACK 2654#1] 443  >  63207 [ACK] Seq=6811 Ack=2066 Win=525056 Len=0 SLE=654 SRE=2066;;;;;;;;;50871834
2705;50.875.049;52.109.124.47;192.168.100.17;TCP;66;[TCP Dup ACK 2655#1] 443  >  63208 [ACK] Seq=5927 Ack=2132 Win=525056 Len=0 SLE=720 SRE=2132;;;;;;;;;50875049
2706;50.875.049;52.109.124.47;192.168.100.17;TCP;66;[TCP Dup ACK 2692#1] 443  >  63206 [ACK] Seq=6861 Ack=2061 Win=525056 Len=0 SLE=649 SRE=2061;;;;;;;;;50875049
2708;50.879.689;52.109.56.20;192.168.100.17;TLSv1.2;1156;Application Data;;;;;;;;;50879689
2709;50.879.689;52.109.124.47;192.168.100.17;TLSv1.2;988;Application Data;;;;;;;;;50879689
